{"eligibility_report_hash":"ec183d55f54367b5fd694de21074e64d2da6b973e9b1e40ee0737fc7043f552c","gates":[{"evidence":["external_source/snapshots/apache_polaris/history/pr.json","configs/experiment.yaml"],"id":"P1-E1","name":"Independent origin","passed":true,"reason_codes":[]},{"evidence":["external_source/snapshots/apache_polaris/history/issue_comments.json","external_source/snapshots/apache_polaris/post/extensions/auth/opa/src/main/java/org/apache/polaris/extension/auth/opa/model/Context.java","external_source/snapshots/apache_polaris/history/review_comments.json","external_source/snapshots/apache_polaris/post/CHANGELOG.md","external_source/snapshots/apache_polaris/history/files.json","external_source/snapshots/apache_polaris/history/reviews.json"],"id":"P1-E2","name":"Historical change","passed":true,"reason_codes":[]},{"evidence":["external_source/source_manifest.json","results/external_validation_v01/external_v01_polaris_pr4992/reports/source_lock_determinism.json"],"id":"P1-E3","name":"Source recoverability","passed":true,"reason_codes":[]},{"evidence":["external_source/evidence_index.json","external_source/native_case_index.json","results/external_validation_v01/external_v01_polaris_pr4992/reports/native_replay.json"],"id":"P1-E4","name":"Authorization target","passed":true,"reason_codes":[]},{"evidence":["external_source/native_case_index.json","results/external_validation_v01/external_v01_polaris_pr4992/reports/case_index_determinism.json"],"id":"P1-E5","name":"Native cases","passed":true,"reason_codes":[]},{"evidence":["external_source/evidence_index.json","external_source/snapshots/apache_polaris/history/files.json"],"id":"P1-E6","name":"Intervention surface","passed":true,"reason_codes":[]},{"evidence":["external_source/native_case_index.json","external_source/evidence_index.json"],"id":"P1-E7","name":"No PC contamination","passed":true,"reason_codes":[]},{"evidence":["results/external_validation_v01/external_v01_polaris_pr4992/reports/native_replay.json"],"id":"P1-E8","name":"Execution or reconstruction","passed":true,"reason_codes":[]}],"limitations":["The upstream regression suite does not contain a single paired test that executes colliding names in two realms against one realm-sensitive Rego policy.","Phase 1 establishes a native authorization-input certificate target; Phase 2 must determine whether terminal decision semantics are point identified.","Only the historical realm-injection intervention is admitted; no non-representation competing route is currently source-grounded."],"metrics":{"artifact_count":26,"artifact_hash_coverage_percent":100.0,"artifacts_hash_verified":26,"case_index_exact_reconstruction":true,"console_log_comments_adjacent":true,"console_log_statement_count":24,"eligibility_gates_passed":8,"eligibility_gates_total":8,"manual_resource_label_count":0,"native_case_count":8,"native_case_source_linkage_percent":100.0,"native_cases_source_linked":8,"pc_generated_primary_case_count":0,"source_fetch_passes":2},"native_replay":{"checks":{"native_realm_assertions_present":true,"policy_document_defines_allow_deny":true,"post_build_context_emits_realm":true,"post_context_interface_requires_realm":true,"post_factory_reads_realm_context":true,"post_schema_requires_realm":true,"pre_build_context_omits_realm":true,"pre_context_interface_omits_realm":true,"pre_schema_omits_realm":true},"commands":["git show <pre_ref>:<source_path>","git show <post_ref>:<source_path>","parse frozen JSON schema and Java/test snapshots"],"mode":"DETERMINISTIC_SOURCE_FAITHFUL_REPLAY","native_case_count":8,"passed":true,"post_ref":"d0a8dff401e30cab1df3ca6d0e133816e80e9c10","pre_ref":"68cba2027e97683cfe62502cc2982c93e74e53e6"},"overall_status":"ELIGIBLE","phase2_authorized":true,"preregistration_hash":"e15968f42a911933de98b007ff6524de6a89141cda2f09f26cfcae1dae7896c1","route_surface":{"admitted":[{"description":"Thread the required RealmContext identifier through the OPA factory and authorizer into input.context.realm.","id":"historical_context_realm_injection","provenance":"apache/polaris#4992"}],"admitted_count":1,"competing_route_count":0,"counterfactual_disposition":"ELIGIBLE_FOR_ROUTE_DEGENERATE_CONTRACT_RECOVERY","excluded_candidates":[{"id":"switch_to_internal_authorizer","reason":"Changes the authorization mechanism and is not established by PR 4992 as a same-instance repair action."},{"id":"switch_to_ranger_authorizer","reason":"Changes the authorization mechanism and is not established by PR 4992 as a same-instance repair action."},{"id":"configure_per_realm_opa_policy_uri","reason":"The pre-repair OPA configuration is application-scoped and the factory does not derive policyUri from RealmConfig."},{"id":"globally_rename_principals_or_resources","reason":"No frozen PR artifact establishes renaming as the historical repair, and it would change native case identity."}],"phase2_requirement":"Do not admit a competing route without additional frozen source provenance.","planning_classification":"ROUTE_DEGENERATE_PENDING_PHASE2"},"run_id":"external_v01_polaris_pr4992","source_manifest_hash":"82498e35c2917fc0d0f3c489e7fddb89680a6eee1a3107e1c6d30ddc2c1d863e","target_recovery":{"distinct_expected_realms":["analytics-realm","catalog-realm","explicit-realm","factory-realm","prod-realm","realm-b","tenant-xyz","test-realm"],"kind":"AUTHORIZATION_INPUT_CERTIFICATE","limitation":"The upstream regression suite does not contain a single paired test that executes colliding names in two realms against one realm-sensitive Rego policy.","native_case_count":8,"predicate":"input.context.realm equals the realm value injected into the native OPA authorizer path","status":"RECOVERED_AS_NATIVE_CERTIFICATE_TARGET","terminal_evidence":"Native tests execute an authorization request against a mock OPA endpoint and assert the emitted certificate field; policy documentation defines allow/deny consumption of that input."}}
